{
  "$schema": "../../../schemas/battle-preset.schema.json",
  "schema_version": 1,
  "id": "cobbleventure:battle/firered_cooltrainer_rolando",
  "enabled": true,
  "name": {
    "ko_kr": "엘리트 트레이너 롤란도 배틀",
    "en_us": "Cooltrainer Rolando Battle"
  },
  "battle": {
    "format": "GEN_9_SINGLES",
    "battle_type": "singles",
    "ai": {
      "controller": "cobbleventure",
      "difficulty": "advanced",
      "strategy": "balanced",
      "options": {}
    },
    "level_mode": "fixed",
    "rules": {
      "can_forfeit": true,
      "max_item_uses": 1
    },
    "bag": [
      {
        "item": "cobblemon:hyper_potion",
        "quantity": 1
      }
    ],
    "mechanics": {
      "mega_evolution": false,
      "z_move": false,
      "dynamax": false,
      "terastallization": false
    },
    "team": [
      {
        "species": "cobblemon:raticate",
        "level": 42,
        "form": null,
        "aspects": [],
        "gender": "random",
        "nature": "hardy",
        "ability": null,
        "held_item": null,
        "gimmick": null,
        "moves": [
          "superfang",
          "pursuit",
          "scaryface",
          "quickattack"
        ],
        "ivs": {
          "hp": 12,
          "attack": 12,
          "defense": 12,
          "special_attack": 12,
          "special_defense": 12,
          "speed": 12
        },
        "evs": {},
        "tera_type": "auto",
        "shiny": false,
        "gigantamax_factor": false
      },
      {
        "species": "cobblemon:ivysaur",
        "level": 42,
        "form": null,
        "aspects": [],
        "gender": "random",
        "nature": "hardy",
        "ability": null,
        "held_item": null,
        "gimmick": null,
        "moves": [
          "razorleaf",
          "sleeppowder",
          "sweetscent",
          "synthesis"
        ],
        "ivs": {
          "hp": 12,
          "attack": 12,
          "defense": 12,
          "special_attack": 12,
          "special_defense": 12,
          "speed": 12
        },
        "evs": {},
        "tera_type": "auto",
        "shiny": false,
        "gigantamax_factor": false
      },
      {
        "species": "cobblemon:wartortle",
        "level": 42,
        "form": null,
        "aspects": [],
        "gender": "random",
        "nature": "hardy",
        "ability": null,
        "held_item": null,
        "gimmick": null,
        "moves": [
          "watergun",
          "bite",
          "rapidspin",
          "tailwhip"
        ],
        "ivs": {
          "hp": 12,
          "attack": 12,
          "defense": 12,
          "special_attack": 12,
          "special_defense": 12,
          "speed": 12
        },
        "evs": {},
        "tera_type": "auto",
        "shiny": false,
        "gigantamax_factor": false
      },
      {
        "species": "cobblemon:charmeleon",
        "level": 42,
        "form": null,
        "aspects": [],
        "gender": "random",
        "nature": "hardy",
        "ability": null,
        "held_item": null,
        "gimmick": null,
        "moves": [
          "flamethrower",
          "slash",
          "smokescreen",
          "scaryface"
        ],
        "ivs": {
          "hp": 12,
          "attack": 12,
          "defense": 12,
          "special_attack": 12,
          "special_defense": 12,
          "speed": 12
        },
        "evs": {},
        "tera_type": "auto",
        "shiny": false,
        "gigantamax_factor": false
      },
      {
        "species": "cobblemon:charizard",
        "level": 42,
        "form": null,
        "aspects": [],
        "gender": "random",
        "nature": "hardy",
        "ability": null,
        "held_item": null,
        "gimmick": null,
        "moves": [
          "flamethrower",
          "wingattack",
          "smokescreen",
          "scaryface"
        ],
        "ivs": {
          "hp": 12,
          "attack": 12,
          "defense": 12,
          "special_attack": 12,
          "special_defense": 12,
          "speed": 12
        },
        "evs": {},
        "tera_type": "auto",
        "shiny": false,
        "gigantamax_factor": false
      }
    ],
    "trainer_id": "cobbleventure:trainer/firered_cooltrainer_rolando"
  }
}
