{
  "$schema": "../../../schemas/battle-preset.schema.json",
  "schema_version": 1,
  "id": "cobbleventure:battle/firered_cooltrainer_yuji",
  "enabled": true,
  "name": {
    "ko_kr": "엘리트 트레이너 유지 배틀",
    "en_us": "Cooltrainer Yuji Battle"
  },
  "battle": {
    "format": "GEN_9_SINGLES",
    "battle_type": "singles",
    "ai": {
      "controller": "cobbleventure",
      "difficulty": "advanced",
      "strategy": "balanced",
      "options": {}
    },
    "level_mode": "fixed",
    "rules": {
      "can_forfeit": true,
      "max_item_uses": 1
    },
    "bag": [
      {
        "item": "cobblemon:hyper_potion",
        "quantity": 1
      }
    ],
    "mechanics": {
      "mega_evolution": false,
      "z_move": false,
      "dynamax": false,
      "terastallization": false
    },
    "team": [
      {
        "species": "cobblemon:sandslash",
        "level": 38,
        "form": null,
        "aspects": [],
        "gender": "random",
        "nature": "hardy",
        "ability": null,
        "held_item": null,
        "gimmick": null,
        "moves": [
          "slash",
          "swift",
          "sandattack",
          "poisonsting"
        ],
        "ivs": {
          "hp": 12,
          "attack": 12,
          "defense": 12,
          "special_attack": 12,
          "special_defense": 12,
          "speed": 12
        },
        "evs": {},
        "tera_type": "auto",
        "shiny": false,
        "gigantamax_factor": false
      },
      {
        "species": "cobblemon:graveler",
        "level": 38,
        "form": null,
        "aspects": [],
        "gender": "random",
        "nature": "hardy",
        "ability": null,
        "held_item": null,
        "gimmick": null,
        "moves": [
          "rockblast",
          "magnitude",
          "mudsport",
          "defensecurl"
        ],
        "ivs": {
          "hp": 12,
          "attack": 12,
          "defense": 12,
          "special_attack": 12,
          "special_defense": 12,
          "speed": 12
        },
        "evs": {},
        "tera_type": "auto",
        "shiny": false,
        "gigantamax_factor": false
      },
      {
        "species": "cobblemon:onix",
        "level": 38,
        "form": null,
        "aspects": [],
        "gender": "random",
        "nature": "hardy",
        "ability": null,
        "held_item": null,
        "gimmick": null,
        "moves": [
          "dragonbreath",
          "sandstorm",
          "rockthrow",
          "bind"
        ],
        "ivs": {
          "hp": 12,
          "attack": 12,
          "defense": 12,
          "special_attack": 12,
          "special_defense": 12,
          "speed": 12
        },
        "evs": {},
        "tera_type": "auto",
        "shiny": false,
        "gigantamax_factor": false
      },
      {
        "species": "cobblemon:graveler",
        "level": 38,
        "form": null,
        "aspects": [],
        "gender": "random",
        "nature": "hardy",
        "ability": null,
        "held_item": null,
        "gimmick": null,
        "moves": [
          "rockblast",
          "magnitude",
          "rollout",
          "defensecurl"
        ],
        "ivs": {
          "hp": 12,
          "attack": 12,
          "defense": 12,
          "special_attack": 12,
          "special_defense": 12,
          "speed": 12
        },
        "evs": {},
        "tera_type": "auto",
        "shiny": false,
        "gigantamax_factor": false
      },
      {
        "species": "cobblemon:marowak",
        "level": 38,
        "form": null,
        "aspects": [],
        "gender": "random",
        "nature": "hardy",
        "ability": null,
        "held_item": null,
        "gimmick": null,
        "moves": [
          "bonemerang",
          "headbutt",
          "leer",
          "growl"
        ],
        "ivs": {
          "hp": 12,
          "attack": 12,
          "defense": 12,
          "special_attack": 12,
          "special_defense": 12,
          "speed": 12
        },
        "evs": {},
        "tera_type": "auto",
        "shiny": false,
        "gigantamax_factor": false
      }
    ],
    "trainer_id": "cobbleventure:trainer/firered_cooltrainer_yuji"
  }
}
