{
  "$schema": "../../schemas/battle-preset.schema.json",
  "schema_version": 1,
  "id": "cobbleventure:battle/sample_camper_jun",
  "enabled": true,
  "name": {
    "ko_kr": "캠프보이 준 배틀"
  },
  "battle": {
    "trainer_id": "cobbleventure:trainer/sample_camper_jun",
    "format": "GEN_9_SINGLES",
    "battle_type": "singles",
    "ai": {
      "controller": "cobbleventure",
      "difficulty": "standard",
      "strategy": "balanced",
      "options": {}
    },
    "level_mode": "map_scaling",
    "level_offset": -1,
    "rules": {
      "can_forfeit": true
    },
    "bag": [],
    "mechanics": {
      "mega_evolution": false,
      "z_move": false,
      "dynamax": false,
      "terastallization": false
    },
    "team": [
      {
        "species": "cobblemon:geodude",
        "level": 9,
        "form": null,
        "aspects": [],
        "gender": "random",
        "nature": null,
        "ability": null,
        "held_item": null,
        "gimmick": null,
        "moves": [
          "tackle",
          "defense_curl",
          "rock_throw"
        ],
        "ivs": {},
        "evs": {},
        "tera_type": "auto",
        "shiny": false,
        "gigantamax_factor": false
      }
    ]
  }
}
