{
  "$schema": "../../../schemas/battle-preset.schema.json",
  "schema_version": 1,
  "id": "cobbleventure:battle/firered_cooltrainer_george",
  "enabled": true,
  "name": {
    "ko_kr": "Cooltrainer George 배틀",
    "en_us": "Cooltrainer George Battle"
  },
  "battle": {
    "format": "GEN_9_SINGLES",
    "battle_type": "singles",
    "ai": {
      "controller": "cobbleventure",
      "difficulty": "advanced",
      "strategy": "balanced",
      "options": {}
    },
    "level_mode": "fixed",
    "rules": {
      "can_forfeit": true,
      "max_item_uses": 1
    },
    "bag": [
      {
        "item": "cobblemon:hyper_potion",
        "quantity": 1
      }
    ],
    "mechanics": {
      "mega_evolution": false,
      "z_move": false,
      "dynamax": false,
      "terastallization": false
    },
    "team": [
      {
        "species": "cobblemon:exeggutor",
        "level": 42,
        "form": null,
        "aspects": [],
        "gender": "random",
        "nature": "hardy",
        "ability": null,
        "held_item": null,
        "gimmick": null,
        "moves": [
          "eggbomb",
          "confusion",
          "stunspore",
          "sleeppowder"
        ],
        "ivs": {
          "hp": 12,
          "attack": 12,
          "defense": 12,
          "special_attack": 12,
          "special_defense": 12,
          "speed": 12
        },
        "evs": {},
        "tera_type": "auto",
        "shiny": false,
        "gigantamax_factor": false
      },
      {
        "species": "cobblemon:sandslash",
        "level": 42,
        "form": null,
        "aspects": [],
        "gender": "random",
        "nature": "hardy",
        "ability": null,
        "held_item": null,
        "gimmick": null,
        "moves": [
          "furyswipes",
          "swift",
          "poisonsting",
          "sandattack"
        ],
        "ivs": {
          "hp": 12,
          "attack": 12,
          "defense": 12,
          "special_attack": 12,
          "special_defense": 12,
          "speed": 12
        },
        "evs": {},
        "tera_type": "auto",
        "shiny": false,
        "gigantamax_factor": false
      },
      {
        "species": "cobblemon:cloyster",
        "level": 42,
        "form": null,
        "aspects": [],
        "gender": "random",
        "nature": "hardy",
        "ability": null,
        "held_item": null,
        "gimmick": null,
        "moves": [
          "spikecannon",
          "spikes",
          "aurorabeam",
          "supersonic"
        ],
        "ivs": {
          "hp": 12,
          "attack": 12,
          "defense": 12,
          "special_attack": 12,
          "special_defense": 12,
          "speed": 12
        },
        "evs": {},
        "tera_type": "auto",
        "shiny": false,
        "gigantamax_factor": false
      },
      {
        "species": "cobblemon:electrode",
        "level": 42,
        "form": null,
        "aspects": [],
        "gender": "random",
        "nature": "hardy",
        "ability": null,
        "held_item": null,
        "gimmick": null,
        "moves": [
          "spark",
          "sonicboom",
          "screech",
          "lightscreen"
        ],
        "ivs": {
          "hp": 12,
          "attack": 12,
          "defense": 12,
          "special_attack": 12,
          "special_defense": 12,
          "speed": 12
        },
        "evs": {},
        "tera_type": "auto",
        "shiny": false,
        "gigantamax_factor": false
      },
      {
        "species": "cobblemon:arcanine",
        "level": 42,
        "form": null,
        "aspects": [],
        "gender": "random",
        "nature": "hardy",
        "ability": null,
        "held_item": null,
        "gimmick": null,
        "moves": [
          "flamewheel",
          "roar",
          "bite",
          "takedown"
        ],
        "ivs": {
          "hp": 12,
          "attack": 12,
          "defense": 12,
          "special_attack": 12,
          "special_defense": 12,
          "speed": 12
        },
        "evs": {},
        "tera_type": "auto",
        "shiny": false,
        "gigantamax_factor": false
      }
    ],
    "trainer_id": "cobbleventure:trainer/firered_cooltrainer_george"
  }
}
